{
  "schema_version": "1.0.0",
  "generated_at": "2026-05-07T00:00:00Z",
  "agent": {
    "name": "Vault Implementation Agent",
    "version": "1.0.0"
  },
  "mode": "dry-run",
  "inputs_reviewed": [
    "reports/vault-discovery-report.md",
    "reports/vault-discovery-report.json",
    "reports/vault-pattern-decision.md",
    "reports/vault-migration-plan.md",
    "reports/vault-migration-plan.json"
  ],
  "approval_and_scope": {
    "approval_status": "Not approved",
    "approved_scope": [],
    "scope_notes": "Implementation requires explicit approval before editing application files."
  },
  "selected_pattern": {
    "composed_pattern": "Kubernetes Auth + Vault Agent Injector + KV v2",
    "delivery_pattern": "Vault Agent Injector",
    "auth_method": "Kubernetes Auth",
    "secret_engine": "KV v2"
  },
  "skills_applied": [
    {
      "skill": "vault-agent-injector-implementation",
      "status": "Would run",
      "reason": "Selected delivery pattern is Vault Agent Injector."
    },
    {
      "skill": "vault-kubernetes-auth-implementation",
      "status": "Would run",
      "reason": "Selected auth method is Kubernetes Auth."
    },
    {
      "skill": "vault-kv-static-secret-implementation",
      "status": "Would run",
      "reason": "Selected secret engine includes KV v2."
    }
  ],
  "files_changed": [
    {
      "path": "deploy/app.yaml",
      "change_type": "Would change",
      "summary": "Add Vault Agent Injector annotations with placeholders."
    }
  ],
  "files_intentionally_not_changed": [
    "Application source code because the selected initial pattern is config/deployment based.",
    "Terraform secret payload resources because static secret values must not enter state.",
    "Existing Kubernetes Secret source because rollback window must remain available."
  ],
  "secret_safety_controls": [
    "No secret values added.",
    "Placeholder values only.",
    "Existing secret source retained for rollback."
  ],
  "implementation_details": [
    "Dry-run only.",
    "Pattern-specific skills selected from migration plan.",
    "No source files modified."
  ],
  "validation_performed": [
    {
      "command_or_check": "Secret value exposure check",
      "status": "Skipped",
      "notes": "No implementation changes made."
    }
  ],
  "rollback_notes": [
    "Rollback source must remain available until cutover is complete.",
    "If approved changes fail, revert manifest or Helm values to previous secret source."
  ],
  "residual_risks": [
    "Service account and Vault role binding still require confirmation.",
    "Vault path standard still requires owner approval."
  ],
  "open_questions": [
    "Which namespace and service account should bind to the Vault role?",
    "Is Helm the deployment source of truth or are raw manifests used?"
  ],
  "next_steps": [
    "Confirm implementation approval and scope.",
    "Confirm target files.",
    "Run implementation agent again with explicit approval."
  ]
}

